#CODE;RUSSIAN;x
ENDGAME_TEXT_JEWISH;Вы теперь исповедуете иудаизм, поэтому не можете продолжить игру без дополнения §YSons of Abraham§!.;x
NOT_ALLOWED_JEWISH;Нельзя играть за §Yиудеев§! без дополнения §YSons of Abraham§!!;x
NOT_ALLOWED_JEWISH_MP;§Y$PLAYER$§! не может играть §Yиудеем§! без дополениния §YSons of Abraham§!;x
RD_NOT_PLAYABLE_WITHOUT_SOA_DLC;Персонажи-иудеи не являются игровыми без дополнения §YSons of Abraham§!;x
IRONMAN_MODE_SAVEGAME_DESC;Файл сохранения повреждён или изменён, поэтому не может больше использоваться для режима §YIronman§!.;x
